{
  "retreatId": "chan7-2026",
  "timezone": "America/Chicago",
  "scheduleVersion": "2026-07-16T12:50:00-05:00",
  "owners": {
    "fahui": {
      "displayName": "法輝",
      "color": "#4a5fa5"
    },
    "fawei": {
      "displayName": "法偉",
      "color": "#c15f3c"
    },
    "attendant": {
      "displayName": "侍者",
      "color": "#8a8a83"
    },
    "server": {
      "displayName": "行堂",
      "color": "#8a8a83"
    },
    "duty": {
      "displayName": "監香",
      "color": "#8a8a83"
    },
    "volunteer": {
      "displayName": "義工",
      "color": "#8a8a83"
    },
    "all": {
      "displayName": "全體",
      "color": "#8a8a83"
    },
    "other": {
      "displayName": "其他",
      "color": "#8a8a83"
    }
  },
  "defaultLeadMinutes": 7,
  "defaultEventDurationMinutes": 1,
  "icsFuzzyStrategy": "anchor"
}